{"v":1,"kinds":[{"code":"street","ka":"ქუჩა","ru":"улица","syn":[],"group":"street*"},{"code":"avenue","ka":"გამზირი","ru":"проспект","syn":[],"group":"street*"},{"code":"highway","ka":"გზატკეცილი","ru":"шоссе","syn":[],"group":"street*"},{"code":"road","ka":"გზა","ru":"дорога","syn":[],"group":"street*"},{"code":"embankment","ka":"სანაპირო","ru":"набережная","syn":[],"group":"street*"},{"code":"ascent","ka":"აღმართი","ru":"подъём","syn":[],"group":"street*"},{"code":"descent","ka":"დაღმართი","ru":"спуск","syn":[],"group":"street*"},{"code":"alley","ka":"ხეივანი","ru":"аллея","syn":[],"group":"street*"},{"code":"row","ka":"რიგი","ru":"ряд","syn":[],"group":"street*"},{"code":"lane","ka":"შესახვევი","ru":"переулок","syn":[],"group":"lane*"},{"code":"dead_end","ka":"ჩიხი","ru":"тупик","syn":[],"group":"lane*"},{"code":"passage","ka":"გასასვლელი","ru":"проезд","syn":["съезд"],"group":"lane*"},{"code":"square","ka":"მოედანი","ru":"площадь","syn":[],"group":""},{"code":"bridge","ka":"ხიდი","ru":"мост","syn":[],"group":""},{"code":"tunnel","ka":"გვირაბი","ru":"тоннель","syn":[],"group":""},{"code":"ravine","ka":"ხევი","ru":"балка","syn":["ущелье"],"group":""},{"code":"garden","ka":"სკვერი","ru":"сквер","syn":["сад"],"group":""},{"code":"park","ka":"პარკი","ru":"парк","syn":[],"group":""},{"code":"river","ka":"მდინარე","ru":"река","syn":[],"group":"water*"},{"code":"stream","ka":"ღელე","ru":"ручей","syn":[],"group":"water*"},{"code":"canal","ka":"არხი","ru":"канал","syn":[],"group":"water*"},{"code":"lake","ka":"ტბა","ru":"озеро","syn":[],"group":"water*"},{"code":"metro","ka":"","ru":"метро","syn":["станция"],"group":""},{"code":"district","ka":"რაიონი","ru":"район","syn":[],"group":"area*"},{"code":"neighbourhood","ka":"","ru":"микрорайон","syn":["квартал","местность"],"group":"area*"},{"code":"other","ka":"","ru":"прочее","syn":[],"group":""}],"districts":[{"ka":"მთაწმინდის რაიონი","ru":"Мтацминда","en":"Mtatsminda"},{"ka":"კრწანისის რაიონი","ru":"Крцаниси","en":"Krtsanisi"},{"ka":"ისნის რაიონი","ru":"Исани","en":"Isani"}],"places":[{"ka":"სოლოლაკი","ru":"Сололаки","en":"Sololaki","kind":"neighbourhood","parent":0,"c":[4168990,4479500],"km2":0.54},{"ka":"კალა","ru":"Кала","en":"Kala","kind":"neighbourhood","parent":1,"c":[4168975,4480650],"km2":0.35},{"ka":"ავლაბარი","ru":"Авлабари","en":"Avlabari","kind":"neighbourhood","parent":2,"c":[4169300,4481500],"km2":0.28}],"f":[{"ka":"ლადო ასათიანის ქუჩა","ru":"улица Ладо Асатиани","en":"Lado Asatiani Street","k":0,"fam":0,"d":[0],"p":[0],"len":668,"c":[4169044,4479701],"bb":[4169020,4479300,4169080,4480100],"hn":11},{"ka":"ლადო ასათიანის I შესახვევი","ru":"1-й переулок Ладо Асатиани","en":"Lado Asatiani 1st Lane","k":9,"o":1,"fam":0,"par":0,"d":[0],"p":[0],"len":138,"c":[4169088,4479400],"bb":[4169026,4479400,4169150,4479400],"alt":["Lado Asatiani I Lane"],"hn":2},{"ka":"ლადო ასათიანის II შესახვევი","ru":"2-й переулок Ладо Асатиани","en":"Lado Asatiani 2nd Lane","k":9,"o":2,"fam":0,"par":0,"d":[0],"p":[0],"len":165,"c":[4168967,4479650],"bb":[4168893,4479650,4169041,4479650],"alt":["Lado Asatiani II Lane"],"hn":2},{"ka":"ლადო ასათიანის ჩიხი","ru":"тупик Ладо Асатиани","en":"Lado Asatiani Dead End","k":10,"fam":0,"par":0,"d":[0],"p":[0],"len":72,"c":[4169033,4479950],"bb":[4169000,4479950,4169065,4479950],"hn":0},{"ka":"ლადო ასათიანის გასასვლელი","ru":"проезд Ладо Асатиани","en":"Lado Asatiani Passage","k":11,"fam":0,"par":0,"d":[0],"p":[],"len":66,"c":[4169102,4480065],"bb":[4169075,4480050,4169130,4480080],"hn":0},{"ka":"შოთა რუსთაველის გამზირი","ru":"проспект Шота Руставели","en":"Shota Rustaveli Avenue","k":1,"fam":1,"d":[0],"p":[],"len":1093,"c":[4169796,4479900],"bb":[4169340,4479381,4170095,4480140],"alt":["Rustaveli Ave"],"hn":7},{"ka":"თავისუფლების მოედანი","ru":"площадь Свободы","en":"Freedom Square","k":12,"fam":2,"d":[0],"p":[],"len":0,"c":[4169340,4480140],"bb":[4169280,4480050,4169400,4480230],"old":[{"ka":"ლენინის მოედანი","ru":"площадь Ленина","lat":"Lenin Square","from":1921,"to":1990,"e":15,"src":"enc2008"},{"ka":"ერევნის მოედანი","ru":"Эриванская площадь","lat":"Erivan Square","from":1827,"to":1918,"src":"enc2008"}],"hn":0},{"ka":"გალაკტიონ ტაბიძის ქუჩა","ru":"улица Галактиона Табидзе","en":"Galaktion Tabidze Street","k":0,"fam":3,"d":[0],"p":[0],"len":568,"c":[4169151,4479911],"bb":[4168950,4479700,4169340,4480140],"alt":["Galaktion Tabidze St"],"hn":5,"q":"Q144086"},{"ka":"კოტე აფხაზის ქუჩა","ru":"улица Коте Апхази","en":"Kote Apkhazi Street","k":0,"fam":4,"d":[0,1],"p":[1],"len":913,"c":[4169075,4480560],"bb":[4168850,4480140,4169340,4481020],"old":[{"ka":"ლესელიძის ქუჩა","ru":"улица Леселидзе","lat":"Leselidze St","from":1944,"to":2006,"e":14,"src":"osm"}],"hn":6},{"ka":"ერეკლე II-ის ქუჩა","ru":"улица Ираклия II","en":"Erekle II Street","k":0,"fam":5,"d":[1],"p":[1],"len":347,"c":[4169075,4480575],"bb":[4168950,4480450,4169200,4480700],"hn":3},{"ka":"მეტეხის ხიდი","ru":"Метехский мост","en":"Metekhi Bridge","k":13,"fam":6,"d":[1,2],"p":[],"len":317,"c":[4168965,4481160],"bb":[4168950,4480970,4168980,4481350],"hn":0},{"ka":"მტკვარი","ru":"река Кура","en":"Mtkvari River","k":18,"d":[2],"p":[],"len":2059,"c":[4169099,4481116],"bb":[4168200,4480830,4170000,4481330],"alt":["მდინარე მტკვარი","Kura","Mtkvari"],"hn":0},{"ka":"თავისუფლების მოედანი","ru":"станция метро «Площадь Свободы»","en":"Freedom Square (metro)","k":22,"fam":2,"d":[0],"p":[],"len":0,"c":[4169360,4480090],"bb":[4169360,4480090,4169360,4480090],"alt":["მეტრო თავისუფლების მოედანი"],"hn":0},{"ka":"მთაწმინდის რაიონი","ru":"район Мтацминда","en":"Mtatsminda District","k":23,"d":[0],"p":[],"len":0,"c":[4169450,4479225],"bb":[4168400,4478000,4170500,4480450],"hn":0,"ar":0},{"ka":"სოლოლაკი","ru":"Сололаки","en":"Sololaki","k":24,"d":[0],"p":[0],"len":0,"c":[4168990,4479500],"bb":[4168700,4479000,4169280,4480000],"hn":0,"ar":0},{"ka":"კალა","ru":"Кала","en":"Kala","k":24,"d":[1],"p":[1],"len":0,"c":[4168975,4480650],"bb":[4168700,4480300,4169250,4481000],"alt":["ძველი თბილისი","Старый город"],"hn":0,"ar":1},{"ka":"ეკატერინე გაბაშვილის ქუჩა","ru":"улица Екатерины Габашвили","en":"Ekaterine Gabashvili Street","k":0,"fam":7,"d":[0],"p":[0],"len":460,"c":[4168875,4479625],"bb":[4168850,4479350,4168900,4479900],"hn":4},{"ka":"ვახტანგ გორგასლის ქუჩა","ru":"улица Вахтанга Горгасали","en":"Vakhtang Gorgasali Street","k":0,"fam":8,"d":[1],"p":[1],"len":525,"c":[4168817,4480997],"bb":[4168600,4480950,4169050,4481120],"hn":4},{"ka":"სოლოლაკის აღმართი","ru":"Сололакский подъём","en":"Sololaki Ascent","k":5,"fam":9,"d":[0],"p":[0],"len":213,"c":[4168960,4479200],"bb":[4168900,4479100,4169020,4479300],"hn":1},{"ka":"ზუბალაშვილების ქუჩა","ru":"улица Зубалашвили","en":"Zubalashvili Street","k":0,"fam":10,"d":[0],"p":[0],"len":556,"c":[4169050,4479510],"bb":[4168800,4479500,4169300,4479520],"hn":4},{"ka":"პუშკინის სკვერი","ru":"сквер Пушкина","en":"Pushkin Square","k":16,"fam":11,"d":[0],"p":[],"len":0,"c":[4169435,4480295],"bb":[4169410,4480250,4169460,4480340],"hn":0},{"ka":"რიყის პარკი","ru":"парк Рике","en":"Rike Park","k":17,"fam":12,"d":[2],"p":[2],"len":0,"c":[4169230,4481288],"bb":[4169100,4481110,4169360,4481460],"hn":0},{"ka":"ბესიკის ქუჩა","ru":"улица Бесики","en":"Besiki Street","k":0,"fam":13,"d":[0],"p":[],"len":369,"c":[4169762,4479635],"bb":[4169620,4479520,4169904,4479750],"hn":3},{"ka":"ჩიტაძის ქუჩა","ru":"улица Читадзе","en":"Chitadze Street","k":0,"fam":14,"d":[0],"p":[],"len":349,"c":[4170010,4479600],"bb":[4169900,4479450,4170120,4479750],"hn":2},{"ka":"ალექსანდრე პუშკინის ქუჩა","ru":"улица Пушкина","en":"Pushkin Street","k":0,"fam":11,"d":[0,1],"p":[],"len":379,"c":[4169445,4480320],"bb":[4169340,4480140,4169550,4480500],"hn":3,"q":"Q7200"},{"ka":"ავლაბარი","ru":"Авлабари","en":"Avlabari","k":24,"d":[2],"p":[2],"len":0,"c":[4169300,4481500],"bb":[4169300,4481500,4169300,4481500],"hn":0,"ar":2}],"fam":[{"ka":"ლადო ასათიანის","ru":"Ладо Асатиани","e":0},{"ka":"შოთა რუსთაველის","ru":"Шота Руставели","e":1},{"ka":"თავისუფლების","ru":"Свободы","e":2},{"ka":"გალაკტიონ ტაბიძის","ru":"Галактиона Табидзе","e":3},{"ka":"კოტე აფხაზის","ru":"Коте Апхази","e":4},{"ka":"ერეკლე II-ის","ru":"Ираклия II","e":5},{"ka":"მეტეხის","ru":"Метехский","e":6},{"ka":"ეკატერინე გაბაშვილის","ru":"Екатерины Габашвили","e":7},{"ka":"ვახტანგ გორგასლის","ru":"Вахтанга Горгасали","e":8},{"ka":"სოლოლაკის","ru":"Сололакский","e":9},{"ka":"ზუბალაშვილების","ru":"Зубалашвили","e":10},{"ka":"პუშკინის","ru":"Пушкина","e":11},{"ka":"რიყის","ru":"Рике","e":12},{"ka":"ბესიკის","ru":"Бесики","e":13},{"ka":"ჩიტაძის","ru":"Читадзе"}],"x":[0,1,0,2,0,3,0,4,0,7,0,18,0,19,5,6,5,7,5,8,5,22,5,23,5,24,6,7,6,8,6,24,7,8,7,24,8,9,8,17,8,24,10,11,10,17,16,19,20,24,20,24],"xp":[4169026,4479400,4169041,4479650,4169065,4479950,4169075,4480050,4169050,4479800,4169020,4479300,4169033,4479511,4169400,4480109,4169340,4480140,4169340,4480140,4169904,4479750,4169998,4479583,4169340,4480140,4169280,4480068,4169283,4480230,4169393,4480230,4169340,4480140,4169340,4480140,4169069,4480569,4168866,4480987,4169340,4480140,4168965,4481166,4168950,4480970,4168865,4479517,4169457,4480340,4169410,4480260],"xd":[68,1,68,16,68,16,68,1,68,34,4,32,68,17,17,68,1,32,1,8,136,32,136,34,1,2,132,34,65,136,80,34,32,8,32,2,136,34,136,17,8,2,68,17,4,17,68,17,80,34,5,34],"near":[2,16]}